Category,Term,Count,%,PValue,Genes,List Total,Pop Hits,Pop Total,Fold Enrichment,Bonferroni,Benjamini,FDR
GOTERM_BP_FAT,GO:0019835~cytolysis,6,0.388349515,0.034683259,"ENSG00000176919, ENSG00000157131, ENSG00000113600, ENSG00000151882, ENSG00000073605, ENSG00000108960",1022,26,14269,3.221962969,1,0.812277473,0.805051794
GOTERM_BP_FAT,GO:1903859~regulation of dendrite extension,6,0.388349515,0.034683259,"ENSG00000119866, ENSG00000079841, ENSG00000100884, ENSG00000111344, ENSG00000144550, ENSG00000067715",1022,26,14269,3.221962969,1,0.812277473,0.805051794
GOTERM_BP_FAT,GO:0035767~endothelial cell chemotaxis,6,0.388349515,0.034683259,"ENSG00000156234, ENSG00000136999, ENSG00000105976, ENSG00000179388, ENSG00000196468, ENSG00000156427",1022,26,14269,3.221962969,1,0.812277473,0.805051794
GOTERM_BP_FAT,GO:0090278~negative regulation of peptide hormone secretion,8,0.517799353,0.03527368,"ENSG00000121853, ENSG00000136999, ENSG00000138814, ENSG00000186188, ENSG00000183682, ENSG00000198643, ENSG00000145087, ENSG00000158445",1022,44,14269,2.538516278,1,0.823465755,0.81614055
GOTERM_BP_FAT,GO:0009566~fertilization,19,1.229773463,0.035396495,"ENSG00000177398, ENSG00000106304, ENSG00000104755, ENSG00000064199, ENSG00000143194, ENSG00000109738, ENSG00000173389, ENSG00000198722, ENSG00000116996, ENSG00000157093, ENSG00000177707, ENSG00000118308, ENSG00000079841, ENSG00000166352, ENSG00000182264, ENSG00000255346, ENSG00000090512, ENSG00000103310, ENSG00000184613",1022,159,14269,1.668395919,1,0.823510666,0.816185062
GOTERM_BP_FAT,GO:0010771~negative regulation of cell morphogenesis involved in differentiation,13,0.841423948,0.035501007,"ENSG00000158856, ENSG00000072315, ENSG00000138814, ENSG00000138623, ENSG00000066248, ENSG00000184292, ENSG00000119866, ENSG00000187323, ENSG00000137261, ENSG00000040608, ENSG00000163975, ENSG00000053108, ENSG00000184349",1022,94,14269,1.930892701,1,0.823510666,0.816185062
GOTERM_BP_FAT,GO:0006654~phosphatidic acid biosynthetic process,7,0.453074434,0.035989767,"ENSG00000102780, ENSG00000187980, ENSG00000138678, ENSG00000169692, ENSG00000153933, ENSG00000186281, ENSG00000149091",1022,35,14269,2.792367906,1,0.829581164,0.822201559
GOTERM_BP_FAT,GO:0097484~dendrite extension,7,0.453074434,0.035989767,"ENSG00000119866, ENSG00000079841, ENSG00000100884, ENSG00000111344, ENSG00000107295, ENSG00000144550, ENSG00000067715",1022,35,14269,2.792367906,1,0.829581164,0.822201559
GOTERM_BP_FAT,GO:0033555~multicellular organismal response to stress,12,0.776699029,0.036583438,"ENSG00000043591, ENSG00000126583, ENSG00000138814, ENSG00000132911, ENSG00000198400, ENSG00000186297, ENSG00000003393, ENSG00000137261, ENSG00000073670, ENSG00000170485, ENSG00000078725, ENSG00000171532",1022,84,14269,1.994548504,1,0.840334426,0.832859164
GOTERM_BP_FAT,GO:0048870~cell motility,126,8.155339806,0.036830262,"ENSG00000152582, ENSG00000149292, ENSG00000106328, ENSG00000179388, ENSG00000065534, ENSG00000186081, ENSG00000157873, ENSG00000114861, ENSG00000156427, ENSG00000169744, ENSG00000138792, ENSG00000171811, ENSG00000163485, ENSG00000169224, ENSG00000187210, ENSG00000163249, ENSG00000100346, ENSG00000109670, ENSG00000180921, ENSG00000034239, ENSG00000108861, ENSG00000198053, ENSG00000181751, ENSG00000198576, ENSG00000164619, ENSG00000180383, ENSG00000172403, ENSG00000151882, ENSG00000115423, ENSG00000260001, ENSG00000112276, ENSG00000233608, ENSG00000184292, ENSG00000187323, ENSG00000186111, ENSG00000221866, ENSG00000124721, ENSG00000107485, ENSG00000184613, ENSG00000163818, ENSG00000136999, ENSG00000138814, ENSG00000095203, ENSG00000158023, ENSG00000174951, ENSG00000196468, ENSG00000172139, ENSG00000196900, ENSG00000198915, ENSG00000160791, ENSG00000144824, ENSG00000177398, ENSG00000181378, ENSG00000101040, ENSG00000156234, ENSG00000092445, ENSG00000171450, ENSG00000157168, ENSG00000186891, ENSG00000164362, ENSG00000149269, ENSG00000181649, ENSG00000146038, ENSG00000162981, ENSG00000153233, ENSG00000156466, ENSG00000130635, ENSG00000070087, ENSG00000174175, ENSG00000119042, ENSG00000242221, ENSG00000149091, ENSG00000143556, ENSG00000196639, ENSG00000151208, ENSG00000183691, ENSG00000137261, ENSG00000141655, ENSG00000183734, ENSG00000077327, ENSG00000100092, ENSG00000163606, ENSG00000091972, ENSG00000103888, ENSG00000171236, ENSG00000132386, ENSG00000172602, ENSG00000171631, ENSG00000078098, ENSG00000088727, ENSG00000008086, ENSG00000139174, ENSG00000070808, ENSG00000165757, ENSG00000101222, ENSG00000183049, ENSG00000125850, ENSG00000156687, ENSG00000137809, ENSG00000105974, ENSG00000105976, ENSG00000154429, ENSG00000173389, ENSG00000004399, ENSG00000134013, ENSG00000116106, ENSG00000135346, ENSG00000137642, ENSG00000162493, ENSG00000119547, ENSG00000006210, ENSG00000146242, ENSG00000145675, ENSG00000143013, ENSG00000158856, ENSG00000188906, ENSG00000141738, ENSG00000112658, ENSG00000138623, ENSG00000114315, ENSG00000070193, ENSG00000112655, ENSG00000196776, ENSG00000151388, ENSG00000157368, ENSG00000114554",1022,1502,14269,1.171232877,1,0.840334426,0.832859164
GOTERM_BP_FAT,GO:0051050~positive regulation of transport,77,4.98381877,0.036873235,"ENSG00000156466, ENSG00000024422, ENSG00000105711, ENSG00000065534, ENSG00000158445, ENSG00000067715, ENSG00000198626, ENSG00000175426, ENSG00000163485, ENSG00000115194, ENSG00000134072, ENSG00000137261, ENSG00000100346, ENSG00000109670, ENSG00000106089, ENSG00000141655, ENSG00000168539, ENSG00000198053, ENSG00000182901, ENSG00000041353, ENSG00000198576, ENSG00000103888, ENSG00000150995, ENSG00000111262, ENSG00000171631, ENSG00000152413, ENSG00000118004, ENSG00000081803, ENSG00000143869, ENSG00000070808, ENSG00000184374, ENSG00000186115, ENSG00000183049, ENSG00000100099, ENSG00000166402, ENSG00000167535, ENSG00000148677, ENSG00000179841, ENSG00000178752, ENSG00000198363, ENSG00000105974, ENSG00000138814, ENSG00000110723, ENSG00000172179, ENSG00000198722, ENSG00000137642, ENSG00000006210, ENSG00000166257, ENSG00000126759, ENSG00000186188, ENSG00000145675, ENSG00000188906, ENSG00000266964, ENSG00000171450, ENSG00000111684, ENSG00000139998, ENSG00000121905, ENSG00000159224, ENSG00000196776, ENSG00000151025, ENSG00000137731, ENSG00000011347, ENSG00000185482, ENSG00000006283, ENSG00000185002, ENSG00000054277, ENSG00000164362, ENSG00000128989, ENSG00000036828, ENSG00000147642, ENSG00000101200, ENSG00000091428, ENSG00000099904, ENSG00000169418, ENSG00000166501, ENSG00000120341, ENSG00000125510",1022,867,14269,1.239978828,1,0.840334426,0.832859164
GOTERM_BP_FAT,GO:0009746~response to hexose,20,1.294498382,0.036916293,"ENSG00000138814, ENSG00000067992, ENSG00000112658, ENSG00000120738, ENSG00000198722, ENSG00000159224, ENSG00000158445, ENSG00000171246, ENSG00000132386, ENSG00000175426, ENSG00000009950, ENSG00000185002, ENSG00000163359, ENSG00000036828, ENSG00000147642, ENSG00000054356, ENSG00000012232, ENSG00000162992, ENSG00000166501, ENSG00000101076",1022,171,14269,1.632963688,1,0.840334426,0.832859164
GOTERM_BP_FAT,GO:0060079~excitatory postsynaptic potential,13,0.841423948,0.038099638,"ENSG00000188906, ENSG00000132535, ENSG00000138814, ENSG00000109738, ENSG00000174576, ENSG00000175866, ENSG00000163485, ENSG00000117152, ENSG00000157680, ENSG00000079841, ENSG00000106089, ENSG00000108852, ENSG00000149305",1022,95,14269,1.910567515,1,0.864577802,0.856886881
GOTERM_BP_FAT,GO:0071313~cellular response to caffeine,4,0.258899676,0.039057786,"ENSG00000149554, ENSG00000081248, ENSG00000198626, ENSG00000072954",1022,11,14269,5.077032556,1,0.881068414,0.8732308
GOTERM_BP_FAT,GO:0051674~localization of cell,126,8.155339806,0.039067492,"ENSG00000152582, ENSG00000149292, ENSG00000106328, ENSG00000179388, ENSG00000065534, ENSG00000186081, ENSG00000157873, ENSG00000114861, ENSG00000156427, ENSG00000169744, ENSG00000138792, ENSG00000171811, ENSG00000163485, ENSG00000169224, ENSG00000187210, ENSG00000163249, ENSG00000100346, ENSG00000109670, ENSG00000180921, ENSG00000034239, ENSG00000108861, ENSG00000198053, ENSG00000181751, ENSG00000198576, ENSG00000164619, ENSG00000180383, ENSG00000172403, ENSG00000151882, ENSG00000115423, ENSG00000260001, ENSG00000112276, ENSG00000233608, ENSG00000184292, ENSG00000187323, ENSG00000186111, ENSG00000221866, ENSG00000124721, ENSG00000107485, ENSG00000184613, ENSG00000163818, ENSG00000136999, ENSG00000138814, ENSG00000095203, ENSG00000158023, ENSG00000174951, ENSG00000196468, ENSG00000172139, ENSG00000196900, ENSG00000198915, ENSG00000160791, ENSG00000144824, ENSG00000177398, ENSG00000181378, ENSG00000101040, ENSG00000156234, ENSG00000092445, ENSG00000171450, ENSG00000157168, ENSG00000186891, ENSG00000164362, ENSG00000149269, ENSG00000181649, ENSG00000146038, ENSG00000162981, ENSG00000153233, ENSG00000156466, ENSG00000130635, ENSG00000070087, ENSG00000174175, ENSG00000119042, ENSG00000242221, ENSG00000149091, ENSG00000143556, ENSG00000196639, ENSG00000151208, ENSG00000183691, ENSG00000137261, ENSG00000141655, ENSG00000183734, ENSG00000077327, ENSG00000100092, ENSG00000163606, ENSG00000091972, ENSG00000103888, ENSG00000171236, ENSG00000132386, ENSG00000172602, ENSG00000171631, ENSG00000078098, ENSG00000088727, ENSG00000008086, ENSG00000139174, ENSG00000070808, ENSG00000165757, ENSG00000101222, ENSG00000183049, ENSG00000125850, ENSG00000156687, ENSG00000137809, ENSG00000105974, ENSG00000105976, ENSG00000154429, ENSG00000173389, ENSG00000004399, ENSG00000134013, ENSG00000116106, ENSG00000135346, ENSG00000137642, ENSG00000162493, ENSG00000119547, ENSG00000006210, ENSG00000146242, ENSG00000145675, ENSG00000143013, ENSG00000158856, ENSG00000188906, ENSG00000141738, ENSG00000112658, ENSG00000138623, ENSG00000114315, ENSG00000070193, ENSG00000112655, ENSG00000196776, ENSG00000151388, ENSG00000157368, ENSG00000114554",1022,1504,14269,1.169675386,1,0.881068414,0.8732308
GOTERM_BP_FAT,GO:0002920~regulation of humoral immune response,8,0.517799353,0.03929227,"ENSG00000167754, ENSG00000156234, ENSG00000169035, ENSG00000157131, ENSG00000113600, ENSG00000116996, ENSG00000102794, ENSG00000096088",1022,45,14269,2.482104805,1,0.88341113,0.875552676
GOTERM_BP_FAT,GO:0051260~protein homooligomerization,21,1.359223301,0.040135476,"ENSG00000026559, ENSG00000151790, ENSG00000112619, ENSG00000198576, ENSG00000111218, ENSG00000113600, ENSG00000198765, ENSG00000171385, ENSG00000171126, ENSG00000158445, ENSG00000111262, ENSG00000164794, ENSG00000119866, ENSG00000003393, ENSG00000100379, ENSG00000182255, ENSG00000107593, ENSG00000183775, ENSG00000108852, ENSG00000124134, ENSG00000185933",1022,184,14269,1.593470816,1,0.894320342,0.886364845
GOTERM_BP_FAT,GO:0008045~motor neuron axon guidance,6,0.388349515,0.040144666,"ENSG00000122877, ENSG00000183691, ENSG00000221866, ENSG00000116106, ENSG00000128656, ENSG00000143013",1022,27,14269,3.102631007,1,0.894320342,0.886364845
GOTERM_BP_FAT,GO:0045907~positive regulation of vasoconstriction,6,0.388349515,0.040144666,"ENSG00000196639, ENSG00000113749, ENSG00000105974, ENSG00000036828, ENSG00000102468, ENSG00000101200",1022,27,14269,3.102631007,1,0.894320342,0.886364845
GOTERM_BP_FAT,GO:0046834~lipid phosphorylation,9,0.582524272,0.04071989,"ENSG00000102780, ENSG00000137825, ENSG00000101082, ENSG00000157680, ENSG00000166908, ENSG00000186111, ENSG00000153933, ENSG00000145675, ENSG00000149091",1022,55,14269,2.28466465,1,0.901426,0.893407294
GOTERM_BP_FAT,GO:0030198~extracellular matrix organization,32,2.071197411,0.040883567,"ENSG00000137809, ENSG00000105974, ENSG00000130635, ENSG00000145808, ENSG00000060718, ENSG00000134013, ENSG00000038295, ENSG00000206075, ENSG00000162493, ENSG00000144824, ENSG00000087303, ENSG00000122176, ENSG00000187955, ENSG00000107821, ENSG00000198598, ENSG00000138821, ENSG00000197467, ENSG00000139219, ENSG00000151388, ENSG00000078098, ENSG00000170820, ENSG00000137273, ENSG00000144810, ENSG00000088727, ENSG00000169436, ENSG00000167754, ENSG00000169035, ENSG00000139174, ENSG00000187045, ENSG00000171509, ENSG00000163975, ENSG00000134917",1022,313,14269,1.427408514,1,0.901426,0.893407294
GOTERM_BP_FAT,GO:0048644~muscle organ morphogenesis,10,0.647249191,0.040957087,"ENSG00000160932, ENSG00000183691, ENSG00000173991, ENSG00000118194, ENSG00000060718, ENSG00000065534, ENSG00000160808, ENSG00000157168, ENSG00000198626, ENSG00000148677",1022,65,14269,2.147975312,1,0.901426,0.893407294
GOTERM_BP_FAT,GO:0032922~circadian regulation of gene expression,10,0.647249191,0.040957087,"ENSG00000159208, ENSG00000106546, ENSG00000029153, ENSG00000132326, ENSG00000104856, ENSG00000036672, ENSG00000120738, ENSG00000170485, ENSG00000126368, ENSG00000133794",1022,65,14269,2.147975312,1,0.901426,0.893407294
GOTERM_BP_FAT,GO:0006639~acylglycerol metabolic process,14,0.906148867,0.041711501,"ENSG00000102780, ENSG00000105974, ENSG00000138678, ENSG00000169692, ENSG00000134780, ENSG00000153933, ENSG00000186281, ENSG00000137642, ENSG00000149091, ENSG00000157680, ENSG00000021826, ENSG00000187288, ENSG00000109670, ENSG00000180316",1022,107,14269,1.826782742,1,0.915273081,0.907131196
GOTERM_BP_FAT,GO:0007519~skeletal muscle tissue development,18,1.165048544,0.041898078,"ENSG00000105974, ENSG00000138814, ENSG00000132429, ENSG00000178860, ENSG00000172399, ENSG00000043039, ENSG00000120738, ENSG00000081248, ENSG00000152413, ENSG00000133794, ENSG00000003137, ENSG00000112276, ENSG00000143632, ENSG00000122877, ENSG00000185482, ENSG00000139780, ENSG00000148677, ENSG00000167612",1022,151,14269,1.664325242,1,0.91661453,0.908460713
GOTERM_BP_FAT,GO:0010717~regulation of epithelial to mesenchymal transition,12,0.776699029,0.042404826,"ENSG00000225663, ENSG00000162493, ENSG00000169621, ENSG00000144824, ENSG00000130558, ENSG00000183691, ENSG00000134013, ENSG00000116106, ENSG00000168140, ENSG00000171236, ENSG00000107485, ENSG00000125850",1022,86,14269,1.948163655,1,0.923145095,0.914933184
GOTERM_BP_FAT,GO:0043062~extracellular structure organization,32,2.071197411,0.042521091,"ENSG00000137809, ENSG00000105974, ENSG00000130635, ENSG00000145808, ENSG00000060718, ENSG00000134013, ENSG00000038295, ENSG00000206075, ENSG00000162493, ENSG00000144824, ENSG00000087303, ENSG00000122176, ENSG00000187955, ENSG00000107821, ENSG00000198598, ENSG00000138821, ENSG00000197467, ENSG00000139219, ENSG00000151388, ENSG00000078098, ENSG00000170820, ENSG00000137273, ENSG00000144810, ENSG00000088727, ENSG00000169436, ENSG00000167754, ENSG00000169035, ENSG00000139174, ENSG00000187045, ENSG00000171509, ENSG00000163975, ENSG00000134917",1022,314,14269,1.422862627,1,0.923145095,0.914933184
GOTERM_BP_FAT,GO:1900424~regulation of defense response to bacterium,5,0.323624595,0.042575598,"ENSG00000167754, ENSG00000182261, ENSG00000169035, ENSG00000114861, ENSG00000096088",1022,19,14269,3.674168297,1,0.923145095,0.914933184
GOTERM_BP_FAT,GO:0050770~regulation of axonogenesis,20,1.294498382,0.042894802,"ENSG00000072315, ENSG00000176697, ENSG00000174672, ENSG00000130558, ENSG00000112658, ENSG00000138623, ENSG00000004399, ENSG00000111962, ENSG00000116106, ENSG00000114554, ENSG00000119866, ENSG00000008086, ENSG00000187323, ENSG00000137261, ENSG00000040608, ENSG00000149269, ENSG00000221866, ENSG00000128656, ENSG00000053108, ENSG00000184349",1022,174,14269,1.604809141,1,0.927314554,0.919065554
GOTERM_BP_FAT,GO:0098815~modulation of excitatory postsynaptic potential,8,0.517799353,0.043598554,"ENSG00000188906, ENSG00000101040, ENSG00000132535, ENSG00000117152, ENSG00000079841, ENSG00000118160, ENSG00000106089, ENSG00000175866",1022,46,14269,2.428146005,1,0.934700963,0.926386256
GOTERM_BP_FAT,GO:0006468~protein phosphorylation,134,8.673139159,0.043677413,"ENSG00000099308, ENSG00000163914, ENSG00000112964, ENSG00000169220, ENSG00000065534, ENSG00000157873, ENSG00000156427, ENSG00000113494, ENSG00000143479, ENSG00000163485, ENSG00000134072, ENSG00000163249, ENSG00000109670, ENSG00000130829, ENSG00000094804, ENSG00000108861, ENSG00000184349, ENSG00000198053, ENSG00000126583, ENSG00000118160, ENSG00000110931, ENSG00000164619, ENSG00000111344, ENSG00000172403, ENSG00000154237, ENSG00000163491, ENSG00000003393, ENSG00000143869, ENSG00000185386, ENSG00000092853, ENSG00000166886, ENSG00000106588, ENSG00000176697, ENSG00000174672, ENSG00000198400, ENSG00000105538, ENSG00000026103, ENSG00000196468, ENSG00000116783, ENSG00000160791, ENSG00000188322, ENSG00000149554, ENSG00000160396, ENSG00000107796, ENSG00000070159, ENSG00000131759, ENSG00000092445, ENSG00000171450, ENSG00000120738, ENSG00000138669, ENSG00000157168, ENSG00000074590, ENSG00000164485, ENSG00000163673, ENSG00000141384, ENSG00000135272, ENSG00000164086, ENSG00000186891, ENSG00000036828, ENSG00000149269, ENSG00000090534, ENSG00000184995, ENSG00000101200, ENSG00000123572, ENSG00000071575, ENSG00000153233, ENSG00000156466, ENSG00000132535, ENSG00000067992, ENSG00000070087, ENSG00000135409, ENSG00000134398, ENSG00000152669, ENSG00000152822, ENSG00000159733, ENSG00000143556, ENSG00000117650, ENSG00000081026, ENSG00000183691, ENSG00000107295, ENSG00000126259, ENSG00000070759, ENSG00000141655, ENSG00000127863, ENSG00000168734, ENSG00000177453, ENSG00000072315, ENSG00000103888, ENSG00000171631, ENSG00000170820, ENSG00000008086, ENSG00000139053, ENSG00000070808, ENSG00000183682, ENSG00000122188, ENSG00000165757, ENSG00000183049, ENSG00000177189, ENSG00000105974, ENSG00000197594, ENSG00000105219, ENSG00000172575, ENSG00000196388, ENSG00000116106, ENSG00000133048, ENSG00000179921, ENSG00000008118, ENSG00000137642, ENSG00000007264, ENSG00000187550, ENSG00000006210, ENSG00000266173, ENSG00000186188, ENSG00000102468, ENSG00000146242, ENSG00000164715, ENSG00000145675, ENSG00000127564, ENSG00000108960, ENSG00000158856, ENSG00000188906, ENSG00000138623, ENSG00000114315, ENSG00000070193, ENSG00000139318, ENSG00000081985, ENSG00000157368, ENSG00000056291, ENSG00000156711, ENSG00000158050, ENSG00000009950, ENSG00000004660, ENSG00000162545, ENSG00000166501",1022,1617,14269,1.157010821,1,0.934700963,0.926386256
GOTERM_BP_FAT,GO:0048678~response to axon injury,11,0.71197411,0.043701781,"ENSG00000185924, ENSG00000134986, ENSG00000198400, ENSG00000186907, ENSG00000137261, ENSG00000040608, ENSG00000074660, ENSG00000159224, ENSG00000116106, ENSG00000158445, ENSG00000175426",1022,76,14269,2.020792564,1,0.934700963,0.926386256
GOTERM_BP_FAT,GO:0007018~microtubule-based movement,31,2.006472492,0.044065594,"ENSG00000152582, ENSG00000163913, ENSG00000154429, ENSG00000172575, ENSG00000158023, ENSG00000169064, ENSG00000114446, ENSG00000112981, ENSG00000171811, ENSG00000117155, ENSG00000183833, ENSG00000034239, ENSG00000077327, ENSG00000041353, ENSG00000064199, ENSG00000136883, ENSG00000116852, ENSG00000115423, ENSG00000186094, ENSG00000250685, ENSG00000088727, ENSG00000165972, ENSG00000123977, ENSG00000163075, ENSG00000186710, ENSG00000147642, ENSG00000124721, ENSG00000101222, ENSG00000108852, ENSG00000166402, ENSG00000089177",1022,303,14269,1.428439028,1,0.934700963,0.926386256
GOTERM_BP_FAT,GO:0046069~cGMP catabolic process,3,0.194174757,0.044229385,"ENSG00000115252, ENSG00000186642, ENSG00000112541",1022,5,14269,8.377103718,1,0.934700963,0.926386256
GOTERM_BP_FAT,GO:0035768~endothelial cell chemotaxis to fibroblast growth factor,3,0.194174757,0.044229385,"ENSG00000156234, ENSG00000196468, ENSG00000156427",1022,5,14269,8.377103718,1,0.934700963,0.926386256
GOTERM_BP_FAT,GO:1905232~cellular response to L-glutamate,3,0.194174757,0.044229385,"ENSG00000119866, ENSG00000121905, ENSG00000175866",1022,5,14269,8.377103718,1,0.934700963,0.926386256
GOTERM_BP_FAT,GO:0051928~positive regulation of calcium ion transport,14,0.906148867,0.044450678,"ENSG00000179841, ENSG00000198363, ENSG00000105974, ENSG00000138814, ENSG00000103888, ENSG00000065534, ENSG00000198626, ENSG00000171631, ENSG00000152413, ENSG00000006210, ENSG00000185482, ENSG00000070808, ENSG00000036828, ENSG00000167535",1022,108,14269,1.809868087,1,0.934700963,0.926386256
GOTERM_BP_FAT,GO:0006638~neutral lipid metabolic process,14,0.906148867,0.044450678,"ENSG00000102780, ENSG00000105974, ENSG00000138678, ENSG00000169692, ENSG00000134780, ENSG00000153933, ENSG00000186281, ENSG00000137642, ENSG00000149091, ENSG00000157680, ENSG00000021826, ENSG00000187288, ENSG00000109670, ENSG00000180316",1022,108,14269,1.809868087,1,0.934700963,0.926386256
GOTERM_BP_FAT,GO:0061061~muscle structure development,57,3.689320388,0.044515661,"ENSG00000024422, ENSG00000179388, ENSG00000118194, ENSG00000172399, ENSG00000060718, ENSG00000065534, ENSG00000160808, ENSG00000114861, ENSG00000198626, ENSG00000143632, ENSG00000173714, ENSG00000143119, ENSG00000183691, ENSG00000134072, ENSG00000143473, ENSG00000102683, ENSG00000160932, ENSG00000072110, ENSG00000178860, ENSG00000132429, ENSG00000072195, ENSG00000081248, ENSG00000134247, ENSG00000133794, ENSG00000152413, ENSG00000112276, ENSG00000139174, ENSG00000185386, ENSG00000167612, ENSG00000148677, ENSG00000137809, ENSG00000105974, ENSG00000136999, ENSG00000138814, ENSG00000176697, ENSG00000135903, ENSG00000122877, ENSG00000186260, ENSG00000077092, ENSG00000117152, ENSG00000036672, ENSG00000139780, ENSG00000182389, ENSG00000173991, ENSG00000131759, ENSG00000112658, ENSG00000114315, ENSG00000070193, ENSG00000043039, ENSG00000120738, ENSG00000157168, ENSG00000003137, ENSG00000115641, ENSG00000185482, ENSG00000144857, ENSG00000163359, ENSG00000127578",1022,623,14269,1.277407469,1,0.934700963,0.926386256
GOTERM_BP_FAT,GO:0030514~negative regulation of BMP signaling pathway,9,0.582524272,0.044652633,"ENSG00000105974, ENSG00000174453, ENSG00000183691, ENSG00000187045, ENSG00000164619, ENSG00000188779, ENSG00000215474, ENSG00000137642, ENSG00000180875",1022,56,14269,2.243867067,1,0.934890507,0.926574114
GOTERM_BP_FAT,GO:0010720~positive regulation of cell development,49,3.171521036,0.045624481,"ENSG00000156466, ENSG00000115718, ENSG00000105711, ENSG00000174453, ENSG00000137825, ENSG00000169220, ENSG00000067715, ENSG00000138311, ENSG00000175866, ENSG00000162670, ENSG00000153707, ENSG00000151208, ENSG00000134072, ENSG00000162992, ENSG00000184349, ENSG00000204060, ENSG00000072315, ENSG00000111344, ENSG00000132386, ENSG00000008086, ENSG00000143869, ENSG00000163536, ENSG00000144550, ENSG00000221866, ENSG00000183049, ENSG00000078725, ENSG00000176697, ENSG00000198400, ENSG00000074660, ENSG00000004399, ENSG00000116106, ENSG00000198846, ENSG00000122877, ENSG00000119866, ENSG00000006210, ENSG00000079841, ENSG00000100884, ENSG00000108960, ENSG00000105245, ENSG00000158856, ENSG00000101040, ENSG00000131759, ENSG00000112658, ENSG00000138623, ENSG00000114315, ENSG00000112655, ENSG00000157368, ENSG00000171532, ENSG00000114554",1022,524,14269,1.305591864,1,0.951530695,0.943066278
GOTERM_BP_FAT,GO:0009584~detection of visible light,7,0.453074434,0.045720845,"ENSG00000198691, ENSG00000112619, ENSG00000163914, ENSG00000054277, ENSG00000182389, ENSG00000102001, ENSG00000181656",1022,37,14269,2.6414291,1,0.951530695,0.943066278
GOTERM_BP_FAT,GO:0015732~prostaglandin transport,6,0.388349515,0.046098517,"ENSG00000174640, ENSG00000175003, ENSG00000149452, ENSG00000137204, ENSG00000141655, ENSG00000197901",1022,28,14269,2.991822756,1,0.951530695,0.943066278
GOTERM_BP_FAT,GO:0099560~synaptic membrane adhesion,6,0.388349515,0.046098517,"ENSG00000196083, ENSG00000128594, ENSG00000153707, ENSG00000157168, ENSG00000165379, ENSG00000184349",1022,28,14269,2.991822756,1,0.951530695,0.943066278
GOTERM_BP_FAT,GO:0099505~regulation of presynaptic membrane potential,6,0.388349515,0.046098517,"ENSG00000186297, ENSG00000162728, ENSG00000185760, ENSG00000151834, ENSG00000182255, ENSG00000111262",1022,28,14269,2.991822756,1,0.951530695,0.943066278
GOTERM_BP_FAT,GO:0060562~epithelial tube morphogenesis,30,1.941747573,0.047150988,"ENSG00000163913, ENSG00000248905, ENSG00000105976, ENSG00000105538, ENSG00000004399, ENSG00000114446, ENSG00000116106, ENSG00000198626, ENSG00000115596, ENSG00000151208, ENSG00000183691, ENSG00000101115, ENSG00000091831, ENSG00000143013, ENSG00000147655, ENSG00000173991, ENSG00000133816, ENSG00000131759, ENSG00000112658, ENSG00000114315, ENSG00000070193, ENSG00000112655, ENSG00000184292, ENSG00000143869, ENSG00000139174, ENSG00000036828, ENSG00000149269, ENSG00000107485, ENSG00000125430, ENSG00000125850",1022,293,14269,1.429539884,1,0.969842205,0.961214896
GOTERM_BP_FAT,GO:0051216~cartilage development,20,1.294498382,0.047251105,"ENSG00000160801, ENSG00000156466, ENSG00000136999, ENSG00000112964, ENSG00000131759, ENSG00000112658, ENSG00000119042, ENSG00000134013, ENSG00000060718, ENSG00000043039, ENSG00000139219, ENSG00000138669, ENSG00000151388, ENSG00000133048, ENSG00000156427, ENSG00000077092, ENSG00000183691, ENSG00000183682, ENSG00000107485, ENSG00000147655",1022,176,14269,1.586572674,1,0.969842205,0.961214896
GOTERM_BP_FAT,GO:0098703~calcium ion import across plasma membrane,8,0.517799353,0.048197722,"ENSG00000179841, ENSG00000138814, ENSG00000006283, ENSG00000118160, ENSG00000100346, ENSG00000081248, ENSG00000130054, ENSG00000102001",1022,47,14269,2.376483324,1,0.983048898,0.974304108
GOTERM_BP_FAT,GO:1990035~calcium ion import into cell,8,0.517799353,0.048197722,"ENSG00000179841, ENSG00000138814, ENSG00000006283, ENSG00000118160, ENSG00000100346, ENSG00000081248, ENSG00000130054, ENSG00000102001",1022,47,14269,2.376483324,1,0.983048898,0.974304108
GOTERM_BP_FAT,GO:0048871~multicellular organismal homeostasis,36,2.330097087,0.048298146,"ENSG00000184956, ENSG00000160801, ENSG00000105976, ENSG00000163914, ENSG00000139988, ENSG00000020129, ENSG00000135324, ENSG00000169744, ENSG00000163485, ENSG00000138376, ENSG00000161048, ENSG00000102468, ENSG00000141655, ENSG00000198691, ENSG00000043591, ENSG00000112658, ENSG00000138821, ENSG00000139219, ENSG00000120738, ENSG00000116039, ENSG00000003137, ENSG00000152413, ENSG00000170820, ENSG00000154237, ENSG00000132465, ENSG00000009950, ENSG00000086300, ENSG00000139174, ENSG00000187045, ENSG00000183682, ENSG00000186115, ENSG00000101200, ENSG00000102575, ENSG00000180316, ENSG00000166402, ENSG00000126368",1022,366,14269,1.373295692,1,0.983048898,0.974304108
